P23,Ferri et al. (2022),"Ferri, Pablo; Sáez, Carlos; Félix-De Castro, Antonio; Sánchez-Cuesta, Purificación; García-Gómez, Juan M.",Discovering key topics in emergency medical dispatch from free text dispatcher observations,Studies in Health Technology and Informatics,2022,IOS Press,Topic modeling; LDA,TA4. Topic modeling,Government websites,DS4. Government website/platform,Automation of content analysis and extraction; identification of key topics in emergency medical dispatch,F1. Automatic content analysis and extraction; F2. Patterns identification,economic value; administrative value; citizen value,EV. Economic value; AV. Administrative value; CV. Citizen value,increased efficiency; time saving for the authorities; happier customer; increase in number of services delivered;,EV1. Increased efficiency; EV2. Time-saving for the authorities and businesses; SV1. Satisfied public service user; CV4. Increase in number of services delivered;,Co-design,P1. Co-design,Informing,M1_2. Informing,Health,"Update of structured emergency triage algorithms to directly include this latent information in the triage process, resulting in a positive impact in patient wellbeing and health services sustainability",health,PS1. Health,Improving health services,n.a.,quantitative; secondary data;,citizens; government agencies;,,,,,
P24,Cantador et al. (2021),"Cantador, Iván; Viejo-Tardío, Jesús; Cortés-Cediel, María E.; Rodríguez Bolívar, Manuel Pedro",A chatbot for searching and exploring open data: Implementation and evaluation in e-government,ACM International Conference Proceeding Series,2021,ACM,Chatbot,TA2. Chatbot,User generated (text or speech),DS1. User generated (text or speech),Automation of content analysis and extraction; exploration of large data volumes,F1. Automatic content analysis and extraction,economic value; administrative value,EV. Economic value; AV. Administrative value,time saving for the authorities; increased efficiency;,EV2. Time-saving for the authorities and businesses; EV1. Increased efficiency;,Co-design,P1. Co-design,Consulting & ideation,M1_1. Consultation and ideation,eGovernment,Searching and exploring open data relevant for E-Government,generic (civic public services),Generic,Improving open government data search with chatbots,n.a.,qualitative; prototyping,citizens; government agencies;,,,,,
P25,Muliawaty et al. (2019),"Muliawaty, Lia; Alamsyah, Kamal; Salamah, Ummu; Maylawati, Dian Sa",The concept of big data in bureaucratic service using sentiment analysis,International Journal of Sociotechnology and Knowledge Development,2019,Information Resources Management Association,Sentiment,TA3. Sentiment analysis,Social Media (Twitter),DS2. Social media,Automation of content analysis and extraction; identification of societal opinion,F1. Automatic content analysis and extraction; F2. Patterns identification; F4. F4. Extracting meaning from user requests/complaints/opinion,economic value; societal value;,EV. Economic value; SV. Societal value,increased efficiency; happier customer;,EV1. Increased efficiency; SV1. Satisfied public service user;,Co-evaluation,P3. Co-evaluation,Citizen reporting,M3_1. Citizen reporting,Generic,Analyzing the opinions about bureaucratic service,generic (civic public services),Generic,Improving customer satisfaction,Indonesia,quantitative; secondary data; computer modeling,citizens; government agencies;,,,,,
P26,Gerontas et al. (2022),"Gerontas, Alexandros; Zeginis, Dimitris; Promikyridis, Rafail; Androš, Marin; Tambouris, Efthimios; Cipan, Vibor; Tarabanis, Konstantinos",Enhancing core public service vocabulary to enable public service personalization,Information (Switzerland),2022,MDPI,Knowledge graph; chatbot,TA2. Chatbot; TA5. Semantic Web and Linked Data,User generated (text or speech),DS1. User generated (text or speech),Question answering;,F3. Question answering,economic value; administrative value; societal value; citizen value,EV. Economic value; AV. Administrative value; SV. Societal value; CV. Citizen value,increased efficiency; better contact with public administration; personalized public service; happier customer; personalized service delivery;,EV1. Increased efficiency; EV3. Easier to contact with public service; SV1. Satisfied public service user; CV6. Personalized service delivery;,Co-design,P1. Co-design,Consulting & ideation,M1_1. Consultation and ideation,Health,Public service personalization,generic (civic public services),PS1. Health,Personalizing public services,Bjelovar/ Croatia,qualitative; prototyping; case study; conceptual modeling,citizens; government agencies; NLP experts,,,,,
P27,Henman (2020),"Henman, Paul","Improving public services using artificial intelligence: possibilities, pitfalls, governance",Asia Pacific Journal of Public Administration,2020,Routledge,AI; automated decision-making; chatbot,TA7. Artificial Neural Networks; TA2. Chatbot,User generated (text or speech),DS1. User generated (text or speech),"Recognizing patterns; identification of passenger risk profiles at the airport; identification of the level of risk of child maltreatment; identification of long-term unemployment, recidivism, tax/welfare fraud or food violation vendors; predictive modelling of demand at hospitals, prediction of forest fire; automated traffic control; prediction of locations and times of theft; question answering; navigating complex policies and legislation",F2. Patterns identification,"economic value; administrative
value; societal value; citizen value",EV. Economic value; AV. Administrative value; SV. Societal value; CV. Citizen value,less government expenditure; less human resources; increased efficiency; better contact with public administration; enhance the use of digitalization and new business models; time saving for the authorities and businesses; easier business compliance with rules and regulation; personalized public service; single line of communication; increase trust in the public sector; happier customer; better services due to quality standards; personalized service delivery; increase in number of services delivered; reduction of administrative burden; transparency,EV6. Less government expenditure; EV5. Less human resources; EV1. Increased efficiency; EV3. Easier to contact with public service; EV4. Enhance the use of digitalization and new business models and new business models; EV2. Time-saving for the authorities and businesses and businesses; AV3. Easier business compliance with rules and regulations; CV6. Personalized service delivery; AV2. Single line of communication; SV2. Increase trust in public service; SV1. Satisfied public service user; CV3. Better services due to quality standards; CV6. Personalized service delivery; CV4. Increase in number of services delivered; CV2. Reduction of administrative burden; CV1. Transparency,Co-design,P1. Co-design,Informing,M1_2. Informing,Diverse,"Management of large citizen contact volumes, navigation in complex policies and legislation",generic (civic public services),PS4. Policy-making; PS2. Justice,Improving public services with chatbots,n.a.,qualitative; exploratory; literature review,citizens; government agencies; NLP experts,,,,,
P28,Jones and Jones (2019),"Jones, Bronwyn; Jones, Rhianne",Public service chatbots: Automating conversation with BBC News,Digital Journalism,2019,Routledge,News bot,TA2. Chatbot,Social Media (news),DS2. Social media,"Newsgathering bots search, monitor, retrieve, alert or nudge; Production bots collate, analyse, create, edit, visualise, automate news writing; Distribution bots (re-)publish/broadcast, share and respond",F1. Automatic content analysis and extraction; F8. Automatic content generation,economic value;,EV. Economic value,less human resources; increased efficiency; time saving for the authorities,EV5. Less human resources; EV1. Increased efficiency; EV2. Time-saving for the authorities and businesses,Co-design,P1. Co-design,Informing,M1_2. Informing,Journalism; Social Media,"Automating public service media, distribution and editing of news",public service media,PS8. Public service media,Automating public service media production,n.a.,qualitative; case study,citizens; government agencies;,,,,,
P29,Criado and Villodre (2021),"Criado, J. Ignacio; Villodre, Julian",Delivering public services through social media in European local governments. An interpretative framework using semantic algorithms,Local Government Studies,2021,Routledge,Commercial NLP software; semantic algorithms; machine-learning,TA1. Machine learning,Social Media (Twitter),DS2. Social media,Automation of content analysis and extraction; social media analysis,F1. Automatic content analysis and extraction,economic value; societal value;,EV. Economic value; SV. Societal value,increased efficiency; better contact with public administration; happier customer;,EV1. Increased efficiency; EV3. Easier to contact with public service; SV1. Satisfied public service user;,Co-design,P1. Co-design,Consulting & ideation; Informing,M1_1. Consultation and ideation; M1_2. Informing,Generic,Promoting social media use by public administration for public service delivery,public service media / generic (civic public services),PS8. Public service media,Improving public service delivery,"Netherlands, Spain, Sweden, United Kingdom",quantitative; secondary data; conceptual modeling; computer modeling,citizens; government agencies;,,,,,
P30,Makasi et al. (2022),"Makasi, Tendai; Nili, Alireza; Desouza, Kevin C.; Tate, Mary",A typology of chatbots in public service delivery,IEEE Software,2022,IEEE,Chatbot,TA2. Chatbot,Research papers,DS7. Research papers,"Question answering; service triage (first service delivery sophistication level, understanding a citizen request and identifying the appropriate service(s) based on rules); service information gathering and analysis (accessing and collecting data from multiple sources to personalize an individual’s service experience); service negotiation (recommending service offerings that match an applicant’s circumstances and service needs)",F3. Question answering,economic value; administrative value; societal value; citizen value,EV. Economic value; AV. Administrative value; SV. Societal value; CV. Citizen value,less government expenditure; less human resources; increased efficiency; cost effective digitalization; better contact with public administration; enhance the use of digitalization and new business models; time saving for the authorities and businesses;personalized public service; single line of communication; happier customer; better services due to quality standards; personalized service delivery; increase in number of services delivered; reduction of administrative burden; transparency,EV6. Less government expenditure; EV5. Less human resources; EV1. Increased efficiency; EV7. Cost-effective digitalization; EV3. Easier to contact with public service; EV4. Enhance the use of digitalization and new business models and new business models; EV2. Time-saving for the authorities and businesses and businesses; CV6. Personalized service delivery; AV2. Single line of communication; SV1. Satisfied public service user; CV3. Better services due to quality standards; CV4. Increase in number of services delivered; CV2. Reduction of administrative burden; CV1. Transparency,Co-design,P1. Co-design,Consulting & ideation; Informing,M1_1. Consultation and ideation; M1_2. Informing,Generic,Effective chatbot-mediated service delivery,generic (civic public services),Generic,Improving public service delivery,n.a.,qualitative; exploratory; conceptual modeling,citizens; government agencies,,,,,
P31,Grace and Sinor (2021),"Grace, Rob; Sinor, Sierra",How to text 911: A content analysis of text-To-911 public education information,"Proceedings of the 39th ACM International Conference on the Design of Communication: Building Coalitions. Worldwide, SIGDOC 2021",2021,ACM,Content analysis,TA6. Content analysis,Government websites,DS4. Government website/platform,Content analysis;,F7. Information retrieval assistance,"economic value; citizen value
",EV. Economic value; CV. Citizen value,increased efficiency; better services due to quality standards; transparency,EV1. Increased efficiency; CV3. Better services due to quality standards; CV1. Transparency,Co-design,P1. Co-design,Informing,M1_2. Informing,Education; Safety,Communicating information to public regarding emergency management and risks,Education; Safety,PS6. Education,Improving emergency and risk management,Texas/USA,quantitative; secondary data;,citizens; government agencies,,,,,
P32,Vinogradovet al. (2019),"Vinogradov, Andrei; Kurshev, Evgeny; Vlasova, Natalia; Podobryaev, Alexey",Information extraction tasks in public administration domain ISIDA-T natural language processing system,ACM International Conference Proceeding Series,2019,ACM,NLP software; NER; events extraction; relations of the events extraction; situations extraction; visualization of results,TA8. Information extraction,Social Media (news),DS2. Social media,Automation of content analysis and extraction; social media analysis,F1. Automatic content analysis and extraction,economic value; citizen value,EV. Economic value; CV. Citizen value,increased efficiency; transparency,EV1. Increased efficiency; CV1. Transparency,Co-design,P1. Co-design,Informing,M1_2. Informing,Politics,Processing of large amount of textual data and extracting informative insights,Politics,PS7. Politics,Extracting information from documents,Russia,qualitative; prototyping,government agencies; technology companies;,,,,,
P33,"Budiharto, Andreas, and Gunawan (2021)","Budiharto, Widodo; Andreas, Vincent; Gunawan, Alexander Agung Santoso",A novel model and implementation of humanoid robot with facial expression and natural language processing (NLP),"ICIC Express Letters, Part B: Applications",2021,ICIC International,NLP; humanoid robot,TA9. Humanoid robots,User generated (text or speech),DS1. User generated (text or speech),Question answering;,F3. Question answering,economic value; societal value; citizen value,EV. Economic value; SV. Societal value; CV. Citizen value,better contact with public administration; happier customer; reduction of administrative burden;,EV3. Easier to contact with public service; SV1. Satisfied public service user; CV2. Reduction of administrative burden;,Co-design,P1. Co-design,Consulting & ideation,M1_1. Consultation and ideation,Smart City,"Humanoid robots answering questions and communicating with citizens in universities, public services",generic (civic public services),PS6. Education,Humanoid robot-assisted service,Indonesia,qualitative; prototyping,citizens; government agencies; technology companies; private sector companies; academic institutions,,,,,
P34,Miranda and Bringula (2021),"Miranda, John Paul P.; Bringula, Rex P.",Exploring Philippine presidents' speeches: A sentiment analysis and topic modeling approach,Cogent Social Sciences,2021,Taylor & Francis,Sentiment; topic modeling,TA3. Sentiment analysis; TA4. Topic modeling,Social Media (news),DS2. Social media,Automation of content analysis and extraction; identification of sentiments and emergent topics in president annual speeches,F1. Automatic content analysis and extraction; F2. Patterns identification,economic value; citizen value,EV. Economic value; CV. Citizen value,time saving for the authorities; transparency,EV2. Time-saving for the authorities and businesses; CV1. Transparency,Co-design,P1. Co-design,Informing,M1_2. Informing,Politics,Extracting insights from and usefulness of the annual obligatory and traditional president speeches,Politics,PS7. Politics,Analyzing usefulness of annual president speeches,Philippine,qualitative; exploratory; secondary data,citizens; government agencies;,,,,,
P35,"Das, Panda, and Dash (2020)","Das, Rama Krushna; Panda, Manisha; Dash, Sweta Shree",Prioritizing public grievance redressal using text mining and sentimental analysis,Advances in Intelligent Systems and Computing,2020,Springer,Sentiment; text mining,TA1. Machine learning; TA3. Sentiment analysis,User complaint,DS6. User complaint/request,Automation of content analysis and extraction; prioritization of complaints,F1. Automatic content analysis and extraction; F4. Extracting meaning from user requests/complaints/opinion; F6. Prioritizing user requests/complaints/ opinion,economic value; administrative value; societal value; citizen value,EV. Economic value; AV. Administrative value; SV. Societal value; CV. Citizen value,increased efficiency; time saving for the authorities; happier customer; transparency,EV1. Increased efficiency; EV2. Time-saving for the authorities and businesses; SV1. Satisfied public service user; CV1. Transparency,Co-evaluation,P3. Co-evaluation,Citizen reporting,M3_1. Citizen reporting,Generic,Prioritizing the citizen grievances by the ministry,generic (civic public services),Generic,Processing citizens' complaints,India,quantitative; secondary data,citizens; government agencies;,,,,,
P36,Zainol et al. (2021),"Zainol, Zuraini; Nohuddin, Puteri N.E.; Lee, Angela Siew Hoong; Ibrahim, Noor Farizah; Yee, Lu How; Majid, Khairani Abd",Analysing political candidates' popularity on social media using POPularity MONitoring (POPMON),SEARCH Journal of Media and Communication Research,2021,Taylor’s Press,Sentiment; Naive Bayes,TA1. Machine learning; TA3. Sentiment analysis,Social Media (Twitter),DS2. Social media,Automation of content analysis and extraction; social media analysis,F1. Automatic content analysis and extraction; F4. Extracting meaning from user requests/complaints/opinion,economic value; citizen value,EV. Economic value; CV. Citizen value,time saving for the authorities; transparency,EV2. Time-saving for the authorities and businesses; CV1. Transparency,Co-design; co-evaluation,P1. Co-design; P3. Co-evaluation,Informing; Open book government,M1_2. Informing; M3_2. Participatory open data,Politics,"Assisting politicians in improving their public service, assist political parties and their leaders on planning publicity campaigns and predicting the outcomes of future elections",Politics,PS7. Politics,Assisting politicians on planning publicity campaigns and predicting the elections outcomes,USA,quantitative; secondary data,citizens; government agencies;,,,,,
P37,Avgerinos et al. (2021),"Avgerinos Loutsaris, Michalis; Lachana, Zoi; Alexopoulos, Charalampos; Charalabidis, Yannis",Legal text processing: Combing two legal ontological approaches through text mining,ACM International Conference Proceeding Series,2021,ACM,Ontologies; text mining; expert systems,TA1. Machine learning; TA5. Semantic Web and Linked Data,Government database,DS5. Government database/OGD,Question answering; expert systems,F3. Question answering; F7. Information retrieval assistance,economic value; administrative value,EV. Economic value; AV. Administrative value,time saving for the authorities; increased efficiency;,EV2. Time-saving for the authorities and businesses; EV1. Increased efficiency;,Co-design; co-delivery,P1. Co-design; P2. Co-delivery,Informing; crowd-sourcing,M1_2. Informing; M2_1. Crowdsourcing,Legal,"Interoperability of EU legal systems, developing an open and automated legal system capable of providing any EU country's legal information based on the existing ontologies.",justice,PS2. Justice,Interoperability of EU legal systems,"Greece, Austria",qualitative; prototyping; secondary data,citizens; government agencies;,,,,,
P38,Vasconcelos (2020),"Vasconcelos, Anselmo Ferreira",Analyzing the effects of incivility beyond workplaces,International Journal of Organizational Analysis,2020,Emerald,Thematic analysis,TA6. Content analysis,Social Media (news),DS2. Social media,Content analysis;,F7. Information retrieval assistance,societal value; citizen value,EV. Economic value; CV. Citizen value,increase trust in the public sector; transparency,SV2. Increase trust in public service; CV1. Transparency,Co-design,P1. Co-design,Informing,M1_2. Informing,Politics,Analyzing the effects of public strike and its consequences based on the theoretical foundations,"career, Policy making",PS4. Policy-making,Analyzing the effects of public strike and its consequences,Brazil,qualitative; exploratory; secondary data,citizens; government agencies;,,,,,
P39,"Reddick, Chatfield, and Ojo (2017)","Reddick, Christopher G.; Chatfield, Akemi Takeoka; Ojo, Adegboyega",A social media text analytics framework for double-loop learning for citizen-centric public services: A case study of a local government Facebook use,Government Information Quarterly,2017,Elsevier,Entity extraction; keyword extraction; topic modelling; content analysis,TA8. Information extraction; TA4. Topic modeling,Social Media (Facebook),DS2. Social media,Automation of content analysis and extraction; social media analysis,F1. Automatic content analysis and extraction; F4. Extracting meaning from user requests/complaints/opinion,economic value; administrative value; societal value; citizen value,EV. Economic value; AV. Administrative value; SV. Societal value; CV. Citizen value,increased efficiency; better contact with public administration; enhance the use of digitalization; time saving for the authorities; happier customer; better services;,EV1. Increased efficiency; EV3. Easier to contact with public service; EV4. Enhance the use of digitalization and new business models; EV2. Time-saving for the authorities and businesses; SV1. Satisfied public service user;,Co-design; co-evaluation,P1. Co-design; P3. Co-evaluation,Consulting & ideation; Informing; Citizen reporting,M1_1. Consultation and ideation; M1_2. Informing; M3_1. Citizen reporting,Generic,Increasing citizen-centric public service quality,utilities (waste),PS12. Utilities (waste),Improving public services,n.a.,quantitative; secondary data; conceptual modeling,citizens; government agencies;,,,,,
P40,"Hristova, Bogdanova, and Netov (2022)","Hristova, Gloria; Bogdanova, Boiyaiia; Netov, Nikolay",Design of ML-based AI System for mining public opinion on e-government services in Bulgaria,AIP Conference Proceedings,2022,American Institute of Physics,Sentiment,TA3. Sentiment analysis,Social Media,DS2. Social media,Automation of content analysis and extraction; social media analysis,F1. Automatic content analysis and extraction; F4. Extracting meaning from user requests/complaints/opinion,economic value; administrative value; societal value; citizen value,EV. Economic value; AV. Administrative value; SV. Societal value; CV. Citizen value,increased efficiency; better contact with public administration; enhance the use of digitalization; time saving for the authorities; happier customer; better services;,EV1. Increased efficiency; EV3. Easier to contact with public service; EV4. Enhance the use of digitalization and new business models; EV2. Time-saving for the authorities and businesses; SV1. Satisfied public service user;,Co-evaluation,P3. Co-evaluation,Citizen reporting,M3_1. Citizen reporting,eGovernment,Improving e-government / digital public services,generic (civic public services),Generic,Improving public services,Bulgaria,qualitative; prototyping; secondary data,citizens; government agencies;,,,,,
P41,Antoniadis and Tambouris (2021),"Antoniadis, Panteleimon; Tambouris, Efthimios",PassBot: A chatbot for providing information on getting a Greek passport,ACM International Conference Proceeding Series,2021,ACM,Chatbot,TA2. Chatbot,User generated (text or speech),DS1. User generated (text or speech),Question answering;,F3. Question answering,economic value; societal value; citizen value,EV. Economic value; SV. Societal value; CV. Citizen value,better contact with public administration; happier customer; reduction of administrative burden;,EV3. Easier to contact with public service; SV1. Satisfied public service user; CV2. Reduction of administrative burden;,Co-design,P1. Co-design,Consulting & ideation,M1_1. Consultation and ideation,Smart City,Assisting citizens in getting a passport,family,PS5. Family,Assisting citizens in getting a passport,Greece,qualitative; prototyping; case study; secondary data,citizens; government agencies;,,,,,
P42,Santos et al. (2015),"Santos, Breno; Colaço, Methanias; Paixão, Bruno da; Santos, Rafael; Nascimento, André Vinicius; Santos, Hallan dos; Filho, Wallace; Medeiros, Arquimedes de",Comparing Text Mining algorithms for predicting irregularities in public accounts,Proceedings of the XI Brazilian Symposium on Information Systems,2015,AIS,Text classification; Naive Bayes,TA1. Machine learning,Government database,DS5. Government database/OGD,Automation of content analysis and extraction; exploration of large data volumes,F1. Automatic content analysis and extraction,economic value; administrative value; societal value; citizen value,EV. Economic value; AV. Administrative value; SV. Societal value; CV. Citizen value,increased efficiency; enhance the use of digitalization; time saving for the authorities; happier customer; better services;,EV1. Increased efficiency; EV4. Enhance the use of digitalization and new business models; EV2. Time-saving for the authorities and businesses; SV1. Satisfied public service user; better services;,Co-design,P1. Co-design,Informing,M1_2. Informing,Generic,"Predicting irregularities in the public sector records, e.g. reimbursement policies",Audit,PS14. Audit,"Predicting irregularities in the public sector records, e.g. reimbursement policies",Brazil,qualitative; prototyping; case study; secondary data,government agencies;,,,,,
